Factual/False,content string
Factual,pandemic measures had a strong impact on mental and physical health
Factual,legendary actor seanconnery dies at age 90 the first james bond and made it iconic my favorite movie remains entrapment with catherine zeta jones rip legend rt for sean connery like for sean connery how many likes and rt seanconnery
Factual,fauci says comments in trump ad taken out of context and used without my permission everything about trump is fake
Factual,nih expands clinical trials to test convalescent plasma against covid19 national institutes of health
Factual,coronavirus who chief scientist dr soumya swaminathan says precovid life may not return until 2022 covid19 pandemic coronavirusupdate who
Factual,eddie van halen legendary guitarist of van halen dies from cancer at 65 nbc news
Factual,eddie van halen legendary guitarist of van halen dies from cancer at 65
Factual,james bond actor sir sean connery dies at the age of 90
Factual,dr fauci to on trump campaign using him in a campaign ad they did this without my permission and my comments were taken out of context in my 5 decades of public service i have never publicly endorsed nor do i now endorse any political candidates
Factual,researchers have discovered a novel antiviral strategy for treatment of covid19 using existing metallodrugscovid19 covid
Factual,eddie van halen legendary guitarist of van halen dies from cancer at 65
Factual,breaking eddie van halen dies of throat cancer at 65 he was one of the best rockers ever your music will be missed ripeddievanhalen
Factual,listen covid doesnt care about your mask your social distance your plexiglass partition only hcq can stop you from getting infected but fauci doesnt like it does he care about america or pleasing the dem party hmmm survival rate if infected is 9997 live your life
Factual,breaking eddie van halen dies of cancer at age 65
Factual,rip a genius musical change maker one of the greatest to ever do it guitar eddie van halen legendary guitarist dies of cancer at 65
Factual,eddie van halen legendary guitarist dies of cancer at 65
Factual,is there a chance we never get a vaccine for covid19
Factual,new dr fauci says he has been taken out of context in a trump campaign ad that features his comments without my permission in my nearly 5 decades of public service i have never publicly endorsed nor do i now endorse any political candidates
Factual,guitarist eddie van halen dies of cancer at the age of 65 reuters
Factual,is there a cpt code for explaining to patients that having a flu shot will not increase their risk of getting covid19 and that nothing related to covid19 is being put in the vaccines i think i deserve extra compensation for convincing such people to have their flu vaccines
Factual,the comments attributed to me without my permission in the recent trump gop campaign ad were taken out of context from a broad statement i made months ago about the efforts of federal publichealth officials dr fauci 101120
Factual,james bond actor sir sean connery dies at the age of 90 uk media
Factual,the first study to confirm a case of coronavirus reinfection in the us found evidence that an individual with no known immune disorders or underlying health conditions was infected with sarscov2 the virus that causes covid19 in two separate instances
Factual,previous infection with other types of coronaviruses may lessen severity of covid19 being previously infected with a coronaviruses that cause the common cold may decrease the severity of severe acute respiratory syndrome coronavirus sarscov2 infections according to
Factual,if covid19 vaccine is approved could schools mandate getting vaccinated as the search continues for a safe and effective vaccine against covid19 3 experts have weighed in on a question that has been on many parents feed generated with fetchrss
Factual,will your covid19 mask protect you from wildfire smoke as the wildfires rage on people in the west now have to protect themselves not only from the novel coronavirus but from wildfire smoke as well feed generated with fetchrss
Factual,older adults are more at risk for covid19 so why dont vaccine trials include them a recent study published in september in the journal of the american medical association jama revealed that older individuals havent been included feed generated with fetchrss
Factual,guitarist eddie van halen dies of cancer at the age of 65 reuters
Factual,yes its true eddie van halen has died of cancer at 65 which is shocking for not only for myself as a metal head but for the die hard vh fans his freinds and family rest in peace eddie
Factual,this covid19 spike will also hit our mental health with a second wave healthline
Factual,why medical experts support joe bidens 7point plan to beat covid19 healthline talks with medical experts who examine each aspect of joe bidens sevenpoint plan to combat the covid19 pandemic and share why they feed generated with fetchrss
Factual,sir sean connery legendary scottish actor who played james bond 007 dies at a ripe age of 90 their first role model of many yesteryear young ones his the then avtar mingling with bikini clad girls shooting style from hipsmade him famous
Factual,so if the flu vaccine is only about 30 effective how will covid19 vaccine be any more effective than protecting 3 of 10
Factual,what are you going to do if the covid 19 vaccine is made mandatory for the entire world population is there a case for suicide ethically speaking what is the best strategy btw i have no children so i could avoid that dilemma if they plan to separate kids from their family
Factual,breaking indoor dining in nyc can resume at 25 percent capacity starting sept 30 cuomo says
Factual,does having a good level of thiamine sufficiency provide protection against the virus covid19 longhaulers longcovid many people who get infected are asymptomatic it is not clear why some are unaffected while others succumb the evidence of longhauler symptoms
Factual,legendary guitarist eddie van halen dies at 65 eddie van halen the lead guitarist of one of hard rocks biggest band van halen has died after battling with cancer he was 65
Factual,fauci to trump campaign stop trying to hide behind me the comments attributed to me without my permission in the gop campaign ad were taken out of context from a broad statement i made months ago about the efforts of federal public health officials
Factual,covid19 vaccine trial participant tells healthline its the right thing to do a 24yearold nebraska college student is one of the thousands of people who are participating in modernas covid19 vaccine trial feed generated with fetchrss
Factual,we dont yet know whether this will leave these people at risk of reinfection with the virus that causes covid19 but it is essential that everyone continues to follow guidance to reduce the risk to themselves and others
Factual,fda approves gileads remdesivir to treat covid19 despite data showing drug doesnt work
Factual,oh no eddie van halen dies at 65 cancer he made up so much of my childhood playlist rip guitar man
Factual,jamie foxxs younger sister deondra dixon dies at 36
Factual,thismorning if the flu vaccine is only 50 effective how effective will a covid vaccine be
Factual,the washington post alert news alert oct 6 349 pm edt guitar legend eddie van halen dies at 65 his pyrotechnic riffs and solos expanded the vocabulary of hard rock his death from cancer was announced by his son wolfgang
Factual,6 safer ways to celebrate halloween during covid19 get into the spooky spirit safely this halloween with these twists on the traditional holiday activities feed generated with fetchrss
Factual,this very large study has shown that the proportion of people with detectable antibodies is falling over time but we dont yet know whether this will leave these people at risk of reinfection with the virus that causes covid19 prof helen ward
Factual,fauci says he was absolutely not surprised that trump got covid19 related tickers gild jnj lly mrna pfe regn
Factual,fauci says comments in trump ad taken out of context and used without my permission cnbc
Factual,jamesbond actor sir sean connery dies at the age of 90 years
Factual,dr faucis response to being used in a trump campaign ad they did this without my permission and my comments were taken out of context in my 5 decades of public service i have never publicly endorsed nor do i now endorse any political candidates
Factual,guitarist eddie van halen dies of cancer at the age of 65 eddievanhalen eddievanhalenrip
Factual,vitamin and mineral supplements cannot cure covid19 komeshacorona
Factual,rip a legend and wonderful actor sir sean connery dies at the age of 90 for me he was the greatest james bond
Factual,fauci absolutely not surprised trump got covid19
Factual,children may be silent carriers of covid19 researchers are learning how likely it is that children with covid19 will develop noticeable symptoms feed generated with fetchrss
Factual,fauci appears in new trump campaign ad saying i cant imagine that anybody could be doing more fauci tells the comments attributed to me without my permission in the gop campaign ad were taken out of context from a broad statement i made months ago
Factual,theyve killed god i cant feel god my soul is dead the halts covid19 vaccine trials after second volunteer develops neurological problems is there a source for this ive been searching
Factual,is there a fda approved vaccine for coronavirus there are currently no vaccines available for the prevention of covid19 the fda is expediting clinical trials for vaccines by providing timely advice to and interactions with vaccine developers so dont hold your breath
Factual,bars as risky as jails for potential spread of covid19 health experts rank bars and jails as the riskiest places for covid19 transmission feed generated with fetchrss
Factual,covid19 october 2020 coronavirus long covid could be four different syndromes bbc news 10142020 long covid the longlasting impact of coronavirus infection may be affecting people in four different ways according to a review and this could explain why some
Factual,in my nearly five decades of public service i have never publicly endorsed any political candidate the comments attributed to me without my permission in the gop campaign ad were taken out of context fauci said stoptrumplies
Factual,from medscape today fauci masks social distancing likely until 2022 holy shit
Factual,the comments attributed to me without my permission in the gop campaign ad were taken out of context from a broad statement i made months ago about the efforts of federal public health officials fauci blatant deception by trump uselection2020
Factual,the flu vaccine is only 4060 effective and only about half the us population annually chooses to receive it how many will choose to receive the covid vaccine oh waitmaybe if biden is elected he will mandate it
Factual,anyone have any good references on endocrine andor gi complications from covid19 so far all im finding is pts wendocrine andor gi diseases are at increased risk for covid19 some stuff theorizes that sarscov2 can attack the pancreas and cause diabetes
Factual,trump tests negative for sarscov2 on consecutive days doctor says us president donald trump tested negative for sarscov2 on an antigen test his doctor said monday as the president jetted off to florida for his first campaign rally since being diagnosed with the virus
Factual,from back pain to coughing life with longhaul covid19 many covid19 survivors have reported longlingering or recurrent symptoms weeks or even months after tests show their bodies have cleared the virus feed generated with fetchrss
Factual,fauci absolutely not surprised trump got covid19 ymedia southasiandaily
Factual,doctor says donald trump tests negative for covid19 sean conley says trump tested negative on consecutive days as the president returns to the us election campaign trail
Factual,00heaven james bond legend sean connery dies james bond legend sir sean connery has died the scottish star who was the first actor to play 007 on the big screen has passed away at the age of 90 with his family confirming that he died in his sleep while in the bahamas
Factual,breaking news guitar legend eddie van halen dies at age of 65 from battle with cancer ripeddie
Factual,dr fauci to on trump campaign using him in a campaign ad they did this without my permission and my comments were taken out of context in my 5 decades of public service i have never publicly endorsed nor do i now endorse any political candidates
Factual,sir sean connery worlds best and greatest james bond 007 dies at the age of 90 great scottish actor and iconic entertainer a philanthropist he will be solely missed and leaves a great legacyscotland has lost a legend
Factual,i have never publicly endorsed any political candidate the comments attributed to me without my permission in the trump campaign ad were taken out of context from a broad statement i made months ago about the efforts of fed public health officials dr anthony fauci to cnn
Factual,sean conley the presidents physician last night issued a statement that he has tested negative on consecutive days dr conley added that the tests used an antigen card but there had been other evaluations that led him to conclude that mr trump is not infectious to others
Factual,in the news today eddie van halen dutchamerican rock musician guitar rock legend eddie van halen dies of cancer at 65 guitar legend eddie van halen dies at age 65 eddievanhalen
Factual,fauci says he is absolutely not surprised trump got covid19
Factual,eddie van halen dies of cancer at 65 sorry to hear this was part of my teen years
Factual,previous infection with other types of coronaviruses may lessen severity of covid19 being previously infected with bitly3d3joj6
Factual,white house releases memo from the presidents physician citing negative covid19 tests on consecutive days from the abbott binax now testing system
Factual,hku scientists and microbiologists jointly discover a novel antiviral strategy for treatment of covid19 using existing metallodrugs it is showing efficacy to potently suppress sarscov2 replication and relieve viralassociated symptoms in an animal model
Factual,bottom line the mask is not the same thing as the vaccine menu lung disease respiratory health coronavirus news are masks a kind of vaccine against covid19 in early outbreaks of sarscov2 infections on cruise ships before the widespread use of face masks the rate 2
Factual,mysay tidbit abc news fauci says he didnt give permission to be used in trump campaign ad the comments attributed to me without my permission in the gop campaign ad were taken out of context from a broad statement i made months ago
Factual,rip james bond actor sir sean connery dies at the age of 90 uk media
Factual,top us infectious diseases expert dr anthony fauci said he had not agreed to be featured in an ad by president trumps reelection campaign and that his comments were taken out of context rtrs
Factual,obesity may alter immune system response to covid19 obesity may cause a hyperactive immune system response to
Factual,dr fauci trumps new ad i have never publicly endorsed any political candidate the comments attributed to me without my permission in the gop campaign ad were taken out of context from a broad statement i made months ago about the efforts of federal public health officials
Factual,south carolina 3rd grade teacher 28 dies from covid19 teachers and school children dying because of a selfish mean spirited trump old and young blood on trumps hands
Factual,eddie van halen legendary guitarist of van halen dies from cancer at 65
Factual,rt rt dr fauci to on trump campaign using him in a campaign ad they did this without my permission and my comments were taken out of context in my 5 decades of public service i have never publicly endorsed nor do i now endorse any po
Factual,eddie van halen dies at 65 of cancer
Factual,fact vitamin and mineral supplements cannot cure covid19 who is coordinating efforts to develop and evaluate medicines to treat covid19
Factual,james bond actor sir sean connery dies at the age of 90 uk media
Factual,rock legend eddie van halen dies of cancer at age 65 ctv news
Factual,fauci masks social distancing likely until 2022 if social distancing works than why do we need to wear masks if masks work than why do we need lockdowns if lockdowns work then why do we need vaccines wake the f up people this is the nwo
Factual,sean connery dies at the age of 90 20201031seanconnerydead90jamesbond via our 1 favorite 007 james bond one of our favorite actors we lived near sean in lyford cay bahamas when we had a house there a 2min golf cart ride dear god bless sean in heaven
Factual,trumps campaign used fauci in an ad they did this wout my permission and my comments were taken out of context in my 5 decades of public service i have never publicly endorsed nor do i now endorse any political candidates they gonna get enough of fucking wdr fauci
Factual,dr anthony fauci the nations leading infectious disease expert said sunday his comments featured in an ad from the trump campaign about the federal response to the coronavirus pandemic were taken out of context and used without his permission trumpisaloser trumpcovid
Factual,fauci says he is absolutely not surprised trump got covid19 cnn
Factual,dr fauci criticized trump commercial dr fauci released a statement in my nearly 5 decades in public service i have never endorsed any political candidate the comments attributed to me without my permission in the gop campaign ad were taken out of context
Factual,the flu vaccine is not much above 40 effective how effective will these rushed out vaccines be lockdown2
Factual,this covid19 spike will also hit our mental health with a second wave the latest spike in covid19 cases will likely hit americans mental health from financial stress to worries of losing loved ones much harder this feed generated with fetchrss
Factual,trump is so desperate hes using unauthorized material in his adds fauci says comments in trump ad taken out of context and used without my permission trump needs to be sued for illegal use of fauci name
Factual,previous infection with other types of coronaviruses may lessen severity of covid19 being previously infected with a coronaviruses that cause the common cold may decrease the severity of severe acute respiratory syndrome coronavirus sarscov2 infections a new study
Factual,fake news cnn fauci says he is absolutely not surprised trump got covid19 is there anyone who gives a damn what fauci or cnn fake news says or thinks anymore i couldnt care less
Factual,no mouthwash and nasal rinses arent cures for covid19 though mouthwash has been shown to render some types of coronavirus inactive in a lab setting experts say its still unknown if it can help slow the feed generated with fetchrss
Factual,dr fauci to on trump campaign using him in a campaign ad they did this without my permission and my comments were taken out of context in my 5 decades of public service i have never publicly endorsed nor do i now endorse any political candidates we did catch that
Factual,can somebody point me to the study that shows the plexiglass or plastic film dividers between diners in restaurants or bar patrons works to stop the spread of covid this is one of the craziest junk science prevention measures ever
Factual,coronavirus19 pandemic this is an outbreak of historic proportions the likes of which weve not seen in 102 years warns expert nt new 10192020 dr fauci absolutely not surprised that irresponsible trump got covid19 at trump white house superspreader event
Factual,dr fauci says he is absolutely not surprised trump got covid19 trump tested positive after a white house rose garden event
Factual,president trumps doctor says he has tested negative for coronavirus on consecutive days sean conley explained that several different tests and examinations indicate a lack of detectable viral replication
Factual,r i p eddie van halen dies at 65 of cancer
Factual,how the aging process makes older people more vulnerable to covid19 experts say an older persons immune system can overreact as it tries to battle the virus that causes covid19 feed generated with fetchrss
Factual,dr anthony fauci the governments top infectious diseases authority said sunday that he was taken out of context in a new trump campaign ad that features his comments without my permission
Factual,trump uses a misleading clip of dr fauci in an ad promoting trump taking on covid19 fauci tells the comments attributed to me without my permission in the campaign ad were taken out of context from a broad statement i made months ago
Factual,should the fda have approved remdesivir to treat covid19 patients the food and drug administration has approved the antiviral remdesivir as a treatment for covid19 in adults and children 12 years and older paving feed generated with fetchrss
Factual,eddie van halen dies at 65 the cofounder of van halen had been battling throat cancer
Factual,another falsity anthony fauci says he didnt consent to trump ad that takes his words out of context they did this without my permission and my comments were taken out of context fauci said in response to the ad that suggests his endorsement huffpo
Factual,fauci said sunday the comments attributed to me without my permission in the trump campaign ad were taken out of context from a broad statement i made months ago about the efforts of federal public health officials trump thrives on lies falsehood old gangster
Factual,fauci absolutely not surprised trump got covid19 if you know what i mean
Factual,rt dr fauci to on trump campaign using him in a campaign ad they did this without my permission and my comments were taken out of context in my 5 decades of public service i have never publicly endorsed nor do i now endorse any political candidates
Factual,4 simple tips to avoid developing tech neck during covid19 from working at home and remote learning to zoom calls and tv binges the covid19 pandemic has millions of americans spending more time with feed generated with fetchrss
Factual,really sad rock legend eddie van halen dies of cancer at age 65
Factual,breaking news the rock icon legendary guitarist and cofounder of van halen has passed away due to cancer eddie van halen dies at 65
Factual,wearing a mask may reduce how sick you get from covid19 new research suggests that wearing masks not only protects others from the spread of covid19 but may reduce the amount of virus that gets through to feed generated with fetchrss
Factual,fyi dr fauci to on trump campaign using him in a campaign ad they did this without my permission and my comments were taken out of context in my 5 decades of public service i have never publicly endorsed nor do i now endorse any political candidates vote blue
Factual,eddie van halen legendary guitarist of van halen dies from cancer at 65
Factual,dr fauci to on trump campaign using him in a campaign ad they did this without my permission and my comments were taken out of context in my 5 decades of public service i have never publicly endorsed nor do i now endorse any political candidates
Factual,legenda sir sean connery dies aged 90 the scottish actor best known for his portrayal of james bond has died at the age of 90
Factual,breaking approves remdesivir as the first and only drug with full approval to treat covid19 patients says this means the drug has passed all clinical trials and doctors will not need to seek special permissions to treat patients
Factual,why do we allow trump to blatanly lie to us he must go fauci the comments attributed to me without my permission in the gop campaign ad were taken out of context from a broad statement i made months ago about the efforts of federal public health officials
Factual,dr fauci admits amoral trump administration has restricted his media appearances says hes not surprised irresponsible trump got covid dr fauci absolutely not surprised irresonsible trump got covid19 dr fauci absolutely not surprised irresponsible trump g
Factual,fda approves gileads remdesivir to treat covid19 despite data showing drug doesnt work
Factual,cnn title on the tv right now shown on warroompandemic fauci absolutely not surprised that trump got covid19 everybodys ramping up bs ccpvirus news and numbers especially so with the biden hard drive were seeing this right now in illinois information war
Factual,what we know about vitamin d and covidthe authors found that people who had lower vitamin d levels were more likely to experience some negative outcomes of covid19 such as low blood oxygen and death and so recommended that everyone take a vitamin d supplement to stop this
Factual,scientists discover genetic and immunologic underpinnings of some cases of severe covid19 national institutes of health
Factual,in memoriam 1 hour ago sir sean connery dies aged 90 the scottish actor best known for his portrayal of james bond has died at the age of 90
Factual,the cdc warns that your mask will not protect you from smoke but it will protect you from the much smaller wuhan virus per cdc covid19 virus particles are 006 014 microns in size per epa wildfire particles average 25 microns in size am i missing something
Factual,what is long haul covid19 and is trump at high risk president donald trump has recently tested positive for covid19 and is being treated with antiviral and steroid medications feed generated with fetchrss
Factual,dr fauci says he is absolutely not surprised trump got covid19 trump says people are tired of hearing from fauci and all these idiots drama
Factual,novel antiviral strategy for treatment of covid19 researchers have discovered a novel antiviral strategy for treatment of covid19 using existing metallodrugs
