Factual/False,content string
Factual,lot of outrage about the way vaccines are researched tested and will be manufactured by various pharma companies and nations is there a list for people to sign up saying i will not get vaccinated if this vaccine has been produced like this covid19 justasking
Factual,how long does it take for covid19 to stop being contagious though current cdc guidelines suggest most people with covid19 arent contagious 10 days after the onset of symptoms health experts say measuring feed generated with fetchrss
Factual,want to understand covid 19 ignore all cases and test based metrics adjust deaths by excess deaths associated with covid 19 cdc figure out best idea as to infection fatality rate i use 5 thats your number cumulative infections as of 18 days before latest cdc
Factual,today on eddie van halen dies of throat cancer at 65 join us at 230p along w my favorite guitarist my hubby john fattoruso from stereomud and to talk about the end of an era call us w your memoriesthoughts 8008489222
Factual,coming up on channel 109 timing of exercise may lower cancer risk long covid may actually be up to four syndromes more women trying pot in menopause and more tune in
Factual,fda approves remdesivir to treat covid19 hospitalized cases in the usa this is good news and sets the tone for robust testing regimens to most importantly save lives
Factual,covid19 in response to your inquiry regarding the presidents most recent covid19 tests i can share with you that he has tested negative on consecutive days using the abbot binaxnow antigen card white house press secretary kayleigh mcenany said in a statement
Factual,republicans dont want to get a covid19 vaccine because they think the virus is fake democrats dont want one because they think trump is fake which wins the stupidity award is there a vaccine for that if only covid19 covid19
Factual,shocked after reading eddie van halen dies of cancer at 65
Factual,breaking dr fauci is outraged at trump for using his quote out of context in an ad per i have never publicly endorsed any political candidate the comments attributed to me without my permission in the gop campaign ad were taken out of context trump is losing
Factual,you know it usually takes years and years to develop vaccines and even then effectiveness for all vaccines arent 100 the flu vaccine is about 6570 percent effective wonder how long we are gonna let this virus run our lives 3 years 5 years
Factual,sean connery james bond actor dies at 90 sir sean connery has died at the age of 90 his family has said the scottish actor was best known for his portrayal of james bond being the first to bring the role to the big screen appearing in 7 of the spy thrillers source bbc
